{
  "fixture_only": true,
  "contract_version": "v1",
  "runner_id": "iteration4-mock-five-workflow",
  "execution_mode": "mock",
  "case_file": "cases.json",
  "case_ids": [
    "course-knowledge-001",
    "past-paper-question-001",
    "sparse-general-supplement-001",
    "insufficient-evidence-001",
    "multi-turn-followup-001",
    "cross-course-scope-001",
    "source-marking-001",
    "exam-review-fixture-001",
    "mistake-review-fixture-001",
    "temporary-material-fixture-001"
  ],
  "group_by": ["course_id", "category"],
  "fail_on_missing_case": true
}
